<?xml version="1.0" encoding="UTF-8" standalone="no" ?>
<el:level xmlns:xsi="http://www.w3.org/2001/XMLSchema-instance" xsi:schemaLocation="http://enigma-game.org/schema/level/1 level.xsd" xmlns:el="http://enigma-game.org/schema/level/1">
  <el:protected >
    <el:info el:type="level">
      <el:identity el:title="Meditation Disturbance" el:subtitle="Hit by a bolting horse" el:id="20060429ral006"/>
      <el:version el:score="1" el:release="1" el:revision="$Revision: 15 $" el:status="stable"/>
      <el:author  el:name="Ronald Lamprecht" el:email="ral@users.berlios.de"/>
      <el:copyright>Copyright © 2006 Ronald Lamprecht</el:copyright>
      <el:license el:type="GPL v2.0 or above" el:open="true"/>
      <el:compatibility el:enigma="0.92"/>
      <el:modes el:easy="true" el:single="true" el:network="false"/>
      <el:score el:easy="0:11" el:difficult="0:42"/>
    </el:info>
    <el:luamain><![CDATA[
enigma.ConserveLevel = FALSE

levelw = 20
levelh = 13

create_world( levelw, levelh)
draw_border("st-glass")
fill_floor("fl-bluegray", 0,0,levelw,levelh)
set_item("it-hollow", 3, 3)
set_item("it-hollow", 3, 9)
set_item("it-hollow", 16, 3)
set_item("it-hollow", 16, 9)

set_actor("ac-whiteball-small", 7.5, 5.5, {player=0})
set_actor("ac-whiteball-small", 12.5, 5.5, {player=0})
set_actor("ac-whiteball-small", 7.5, 7.5, {player=0})
set_actor("ac-whiteball-small", 12.5, 7.5, {player=0})


if difficult then
    horseforce = 7.2
else
    horseforce = 6
end

set_actor("ac-horse",16.5, 6.5, {force=horseforce, target1="16 3", target2="3 3", target3="3 9", target4="16 9" })
    ]]></el:luamain>
    <el:i18n>
      <el:string el:key="title">
        <el:english el:translate="true"/>
        <el:translation el:lang="de">Ruhestörung bei der Meditation</el:translation>
      </el:string>
      <el:string el:key="subtitle">
        <el:english el:translate="true" el:comment="free translatable joke about being hit by a horse"/>
        <el:translation el:lang="de">Ich glaub mich tritt ein Pferd</el:translation>
      </el:string>
    </el:i18n>
  </el:protected>
</el:level>


